{
  "$schema": "https://json-schema.org/draft/2020-12/schema",
  "$id": "https://portmanager.dev/schemas/web-snapshot-result.schema.json",
  "title": "WebSnapshotResult",
  "type": "object",
  "required": ["schemaVersion", "hostId", "port", "artifactPath", "capturedAt"],
  "properties": {
    "schemaVersion": { "type": "string" },
    "hostId": { "type": "string" },
    "ruleId": { "type": "string" },
    "port": { "type": "integer", "minimum": 1, "maximum": 65535 },
    "artifactPath": { "type": "string" },
    "pageTitle": { "type": "string" },
    "httpStatus": { "type": "integer" },
    "viewport": {
      "type": "object",
      "required": ["width", "height"],
      "properties": {
        "width": { "type": "integer", "minimum": 1 },
        "height": { "type": "integer", "minimum": 1 }
      },
      "additionalProperties": false
    },
    "capturedAt": { "type": "string", "format": "date-time" }
  },
  "additionalProperties": false
}
