{
  "schemaVersion": "0.1.0",
  "hostId": "host_debian_12_review_packet_1776805736172_558",
  "ruleId": "rule_steady_state_review_rule_1776805736384_967",
  "port": 40753,
  "artifactPath": "/tmp/portmanager_analysis_20260416/portmanager/docs/operations/artifacts/debian-12-bootstrap-packet-2026-04-21/diagnostics/op_diag_1776809568435_848/page-snapshot.svg",
  "pageTitle": "Debian 12 Review Relay Healthy",
  "httpStatus": 200,
  "viewport": {
    "width": 1280,
    "height": 720
  },
  "capturedAt": "2026-04-21T22:12:48.441Z"
}